{"citation_keys":["SRC.AB.TAILINGS.2023","SRC.APPLE.MALMODIN.2024","SRC.CEOBS.2023","SRC.CER.AB.2024","SRC.CER.BC.2024","SRC.CER.QC.2024","SRC.CUTA.TTC.2017","SRC.DEFRA.AVIATION.2024","SRC.DIMPACT.2021","SRC.DIMPACT.STREAMING.2022","SRC.DND.2024","SRC.ECCC.NIR.2025","SRC.ECCC.PERMAFROST.2023","SRC.EPA.MOVES.HDV.2021","SRC.EPA.SMARTWAY.2023","SRC.EPA.WARM15.2023","SRC.FAO.IEA.COLDCHAIN.2024","SRC.GNR.2023","SRC.HINTEMANN.2022","SRC.ICAO.CORSIA.2023","SRC.ICAO.CORSIA.2024","SRC.IEA.AVIATION.2023","SRC.IEA.COOLCOALITION.2024","SRC.IEA.COOLING.2024","SRC.IEA.NRCAN.BUILDINGS.2024","SRC.IESO.POWERDATA.2025","SRC.IMO.ICCT.SHIPPING.2023","SRC.INTL.MINING.2022","SRC.NASA.CRYO.2023","SRC.NATO.2023","SRC.NETFLIX.SR.2023","SRC.NIINIMAKI2020","SRC.NOAA.OCEAN.2023","SRC.NRCAN.FREIGHT.2024","SRC.NRCAN.FUEL_LCA.2024","SRC.PLASTICSEUROPE.2022","SRC.POORE2018","SRC.PRIVSEC.2024","SRC.QUANTIS2018","SRC.RIVER.HYPOXIA.2020","SRC.SCOPE3.DATA_TRANSFER.2024","SRC.TORONTO.WATER.AR2023","SRC.UNEP.2022","SRC.UNEP.TEAP.2023","SRC.WORLDSTEEL.2023","SRC.WRAP.2023","SRC.WRAP2017","SRC.IPCC.AR6.WG1.2021"],"figure_id":"feedback","figure_method":"figures.feedback","figure_path":"figures/feedback.6bc0c105.json","figure_sha256":"6bc0c1056f5701f8d9fab14ba7af5dc8790a24f60530d0adee5e29f17bc05c12","generated_at":"1970-01-01T00:00:00+00:00","hash_prefix":"6bc0c105","legacy_figure_path":"figures/feedback.json","numeric_invariance":{"passed":true,"tolerance_percent":0.01},"references":{"legacy_path":"references/feedback_refs.txt","line_count":48,"order":[{"index":1,"source_id":"SRC.AB.TAILINGS.2023"},{"index":2,"source_id":"SRC.APPLE.MALMODIN.2024"},{"index":3,"source_id":"SRC.CEOBS.2023"},{"index":4,"source_id":"SRC.CER.AB.2024"},{"index":5,"source_id":"SRC.CER.BC.2024"},{"index":6,"source_id":"SRC.CER.QC.2024"},{"index":7,"source_id":"SRC.CUTA.TTC.2017"},{"index":8,"source_id":"SRC.DEFRA.AVIATION.2024"},{"index":9,"source_id":"SRC.DIMPACT.2021"},{"index":10,"source_id":"SRC.DIMPACT.STREAMING.2022"},{"index":11,"source_id":"SRC.DND.2024"},{"index":12,"source_id":"SRC.ECCC.NIR.2025"},{"index":13,"source_id":"SRC.ECCC.PERMAFROST.2023"},{"index":14,"source_id":"SRC.EPA.MOVES.HDV.2021"},{"index":15,"source_id":"SRC.EPA.SMARTWAY.2023"},{"index":16,"source_id":"SRC.EPA.WARM15.2023"},{"index":17,"source_id":"SRC.FAO.IEA.COLDCHAIN.2024"},{"index":18,"source_id":"SRC.GNR.2023"},{"index":19,"source_id":"SRC.HINTEMANN.2022"},{"index":20,"source_id":"SRC.ICAO.CORSIA.2023"},{"index":21,"source_id":"SRC.ICAO.CORSIA.2024"},{"index":22,"source_id":"SRC.IEA.AVIATION.2023"},{"index":23,"source_id":"SRC.IEA.COOLCOALITION.2024"},{"index":24,"source_id":"SRC.IEA.COOLING.2024"},{"index":25,"source_id":"SRC.IEA.NRCAN.BUILDINGS.2024"},{"index":26,"source_id":"SRC.IESO.POWERDATA.2025"},{"index":27,"source_id":"SRC.IMO.ICCT.SHIPPING.2023"},{"index":28,"source_id":"SRC.INTL.MINING.2022"},{"index":29,"source_id":"SRC.NASA.CRYO.2023"},{"index":30,"source_id":"SRC.NATO.2023"},{"index":31,"source_id":"SRC.NETFLIX.SR.2023"},{"index":32,"source_id":"SRC.NIINIMAKI2020"},{"index":33,"source_id":"SRC.NOAA.OCEAN.2023"},{"index":34,"source_id":"SRC.NRCAN.FREIGHT.2024"},{"index":35,"source_id":"SRC.NRCAN.FUEL_LCA.2024"},{"index":36,"source_id":"SRC.PLASTICSEUROPE.2022"},{"index":37,"source_id":"SRC.POORE2018"},{"index":38,"source_id":"SRC.PRIVSEC.2024"},{"index":39,"source_id":"SRC.QUANTIS2018"},{"index":40,"source_id":"SRC.RIVER.HYPOXIA.2020"},{"index":41,"source_id":"SRC.SCOPE3.DATA_TRANSFER.2024"},{"index":42,"source_id":"SRC.TORONTO.WATER.AR2023"},{"index":43,"source_id":"SRC.UNEP.2022"},{"index":44,"source_id":"SRC.UNEP.TEAP.2023"},{"index":45,"source_id":"SRC.WORLDSTEEL.2023"},{"index":46,"source_id":"SRC.WRAP.2023"},{"index":47,"source_id":"SRC.WRAP2017"},{"index":48,"source_id":"SRC.IPCC.AR6.WG1.2021"}],"path":"references/feedback_refs.6bc0c105.txt","sha256":"79d5c279de3797d168dcfbbf0cd00e7372fad72b3d1621d71afb1ea2c13fc1f1"},"schema_version":"acx.figure-manifest/1-0-0"}